name,category,neighborhood,description,website,social_media,contact_info,verification_status,last_verified_activity,verification_evidence,source
South Suburban Family Shelter (Anew),Domestic Violence Shelter & Services,South Suburbs (serves South Side Chicago referrals),"Provides emergency shelter, counseling, and legal advocacy for domestic violence survivors in the south suburban and South Side area.",anewdvservices.org,,708-794-2140,STALE,2026-01-01,"Organization renamed to Anew, which is active in 2025/2026.",Chicago_Domestic_Violence_Organizations.xlsx
AIDS Foundation of Chicago (AFC),HIV/AIDS Advocacy & Services,Loop / Downtown,"Founded in 1985, AFC is a leading HIV advocacy organization in Illinois, funding health centers, driving HIV prevention and treatment policy, and working toward Getting to Zero new HIV infections. Partners with 80+ organizations across the state.",https://www.aidschicago.org,,info@aidschicago.org,VERIFIED,2026-06-01,CEO John Peller announced stepping down in Dec 2026.,Chicago_Harm_Reduction_Volunteer_Orgs.xlsx
Illinois Harm Reduction & Recovery Coalition (IHRRC),Coalition / Policy Advocacy,Statewide (Chicago-based),"Statewide coalition (formalized 2022) of dozens of member organizations working to prevent overdose death, reduce drug-use harms, improve treatment access, advance racial equity, and promote a public-health over criminal-justice approach to substance use.",https://www.illinoisharmreduction.org,,info@illinoisharmreduction.org,VERIFIED,2026-05-01,Recognized in academic and policy programming in May 2026.,Chicago_Harm_Reduction_Volunteer_Orgs.xlsx
Live4Lali,Mobile Harm Reduction / Overdose Prevention,Chicagoland / NW Suburbs,"Nonprofit reducing stigma of substance use through education, peer support, and harm reduction. Mobile 'Stigma Crusher' unit deploys weekly across Chicagoland distributing naloxone, fentanyl test strips, sterile syringes, and safer-use kits. Naloxone trainings available community-wide.",https://live4lali.org,,info@live4lali.org,LIKELY_ACTIVE,2026-01-01,Continues to provide services in 2026.,Chicago_Harm_Reduction_Volunteer_Orgs.xlsx
NEXT Harm Reduction (NEXT Distro),Mail-Based Harm Reduction Supplies,Citywide (mail/online),"Online platform and service that mails naloxone, sterile syringes, fentanyl test strips, and other harm reduction supplies directly to people who use drugs in Illinois — no ID or insurance required. Also provides digital health education and linkage to local services.",https://nextdistro.org/illinois,,Via website contact form at nextdistro.org,LIKELY_ACTIVE,2026-01-01,National platform active in IL in 2026.,Chicago_Harm_Reduction_Volunteer_Orgs.xlsx
RUSH Community Health Outreach (CHRO),Medical Outreach / Naloxone Training,West Side (Near Rush Medical Campus),Student-led outreach program at Rush University providing harm reduction education and naloxone distribution bi-weekly at homeless shelters across Chicago's West Side; also runs HIV and hepatitis C screening and linkage to care.,https://www.rushu.rush.edu/student-life/rush-community-service-initiatives-program/outreach-programs,,Via RUSH Community Service Initiatives Program,VERIFIED,2026-06-01,MedSTEM Explorers scheduled for summer 2026.,Chicago_Harm_Reduction_Volunteer_Orgs.xlsx
Sex Worker Outreach Project Chicago (SWOP-Chicago),Sex Worker Harm Reduction / Advocacy,Citywide,"Black-led, peer-led, grassroots volunteer organization dedicated to improving lives of current and former sex workers. Provides condoms, sterile syringes, HIV and STI testing, naloxone, and connections to sex worker-friendly services at street outreach sites across Chicago metro.",https://www.swopchi.org,,Via website contact form at swopchi.org,VERIFIED,2026-03-03,"Exhibit for Int. Sex Workers Rights Day on March 3, 2026.",Chicago_Harm_Reduction_Volunteer_Orgs.xlsx
TASC (Treatment Alternatives for Safe Communities),Criminal Justice / Substance Use Diversion,West Loop / Near South Side,"State-licensed nonprofit providing case management, substance use treatment alternatives to incarceration, and re-entry support for people in the justice system with co-occurring mental health and substance use issues. Runs the Supportive Release Center near Cook County Jail.",https://www.tasc.org,,info@tasc.org,VERIFIED,2026-06-03,"Held 50th anniversary celebration on June 3, 2026.",Chicago_Harm_Reduction_Volunteer_Orgs.xlsx
The Night Ministry,Street Outreach / Harm Reduction / Health,Citywide (bus-based outreach),"Provides human connection, healthcare, and housing support to Chicagoans who are unhoused or in poverty. Operates a Health Outreach Bus (Sun–Thu), Street Medicine Team (Mon–Sat), and CTA Outreach. Distributes harm reduction kits with safe-use supplies, behavioral health support, and substance use treatment referrals.",https://thenightministry.org,,volunteer@thenightministry.org,VERIFIED,2026-04-18,"Hosted 50th anniversary gala on April 18, 2026.",Chicago_Harm_Reduction_Volunteer_Orgs.xlsx
Thresholds,Mental Health / Substance Use Recovery,Ravenswood / Citywide (75+ locations),"Illinois' largest mental health nonprofit, providing integrated mental health, substance use treatment, housing, employment, and primary care services at 75+ locations across Chicago. Uses a harm-reduction model — abstinence not required. Also leads the Illinois Harm Reduction & Recovery Coalition.",https://www.thresholds.org,,ServiceCenter@thresholds.org,VERIFIED,2026-06-01,Issued statement on DOJ memo in June 2026.,Chicago_Harm_Reduction_Volunteer_Orgs.xlsx
Alzheimer's Association Illinois Chapter,Dementia Support & Caregiver Resources,Norwood Park / Citywide,"The Illinois Chapter of the Alzheimer's Association provides education, care consultation, a 24/7 helpline, and advocacy for individuals living with Alzheimer's and all other dementias, and their caregivers. Volunteer opportunities span awareness, community education, fundraising, and advocacy for policy change. The 2026 Walk to End Alzheimer's Chicago seeks event planning committee volunteers.",alz.org/illinois,,N/A (contact via alz.org/illinois/volunteer),VERIFIED,2026-11-13,"Research Symposium scheduled for November 13, 2026.",Chicago_Senior_Elder_Support_Volunteer_Orgs.xlsx
Chicago Hyde Park Village,Aging-in-Place Village Model,Hyde Park,"Community-based membership organization helping Hyde Park residents remain in their homes and engaged in the community as they age. Operates on the 'village' model — trained volunteers provide practical support, social connection, and resource referrals so seniors can age in place. Volunteers are matched with members based on skills and availability.",chpv.org,,volunteer@chpv.org,VERIFIED,2026-06-01,12th Anniversary Charity Auction held May-June 2026.,Chicago_Senior_Elder_Support_Volunteer_Orgs.xlsx
Chicago Methodist Senior Services (CMSS) – Senior Connections,Senior Companion / Intergenerational Programs,Andersonville / Edgewater,"Chicago Methodist Senior Services operates Senior Connections, a free program that matches trained volunteers (18+) with older adults (60+) to create meaningful intergenerational friendships. Volunteers commit to weekly one-hour visits — in person, in a community setting, or by phone — providing conversation, companionship, and connection over shared interests. CMSS also operates affordable senior housing and wellness programs in the Uptown/Edgewater area.",cmsschicago.org,,SeniorConnections@cmsschicago.org,VERIFIED,2026-09-24,2026 Fall Benefit scheduled for September 2026.,Chicago_Senior_Elder_Support_Volunteer_Orgs.xlsx
H.O.M.E. (Housing Opportunities & Maintenance for the Elderly),Senior Housing & Home Repair,Lakeview,"Founded in 1982, H.O.M.E. helps low-income Chicago seniors live independent and socially engaged lives. Owns and manages three affordable intergenerational housing buildings with private apartments and the Good Life Senior Residences. Also provides a home upkeep and repair service, moving assistance, and a shopping bus for seniors throughout the city. Welcomes volunteers for hands-on work in both buildings and the community.",homeseniors.org,,info@homeseniors.org,VERIFIED,2026-03-20,"Hosted Senior Summit & Resource Fair on March 20, 2026.",Chicago_Senior_Elder_Support_Volunteer_Orgs.xlsx
Ignatian Volunteer Corps (IVC) – Chicago,Senior Volunteer Placement,Citywide,The Ignatian Volunteer Corps connects adults aged 50 and older with meaningful part-time volunteer service placements at nonprofits serving communities in need across Chicago. IVC volunteers serve 2 days per week and participate in monthly reflection and community gatherings. Many placements are at elder care and senior service organizations — making IVC an ideal pathway for retired adults who want to serve seniors.,ivcusa.org/ivc-offices/chicago,,cbuescher@ivcusa.org,VERIFIED,2025-09-01,Initiated school partnerships for 2025-2026 academic year.,Chicago_Senior_Elder_Support_Volunteer_Orgs.xlsx
Little Brothers – Friends of the Elderly (Chicago),Elder Companionship / Isolation Prevention,Near West Side / Citywide,"Chicago chapter of the international Little Brothers movement (founded 1946), focused entirely on eliminating loneliness and isolation among older adults aged 70+. Volunteers are matched one-on-one with an isolated elder for long-term friendship — visiting, going on outings, sharing meals, and celebrating holidays together. Also hosts parties, excursions, and social events. One of Chicago's most dedicated elder companionship organizations.",lbfechicago.org,,N/A (contact via lbfechicago.org),VERIFIED,2026-06-01,Conducted wellness checks during summer 2026 heat waves.,Chicago_Senior_Elder_Support_Volunteer_Orgs.xlsx
Meals on Wheels Chicago,Meal Delivery & Nutrition,River North / Citywide,"Since 1987, Meals on Wheels Chicago has provided critical nutrition and wellness support to over 17,500 homebound seniors and individuals with disabilities across the city. 84% of clients report their delivery driver is the only person they see all week — making volunteers an essential link in combating isolation. Volunteers deliver meals, distribute free groceries at the Nourish Chicago Pantry, and support wellness and event programs.",mealsonwheelschicago.org,,info@mealsonwheelschicago.org,VERIFIED,2026-06-01,Feed a Neighbor Fund launched in June 2026.,Chicago_Senior_Elder_Support_Volunteer_Orgs.xlsx
Northside Community Resources (NCR),Senior Case Management / Aging in Place,Rogers Park,"Grassroots nonprofit serving Chicago's North Side since 1989, formerly known as Rogers Park Community Council. Provides at-risk senior case management, home safety and accessibility improvements, emotional wellness support, and connections to community resources — helping isolated and vulnerable seniors remain safely in their homes. Absorbed Caring Connections for Seniors in 2014. Relies heavily on volunteers for direct senior support.",northsidecommunityresources.org,,seniors@northsidecr.org,LIKELY_ACTIVE,2026-01-01,Multiple state/local funded programs active in 2025/2026.,Chicago_Senior_Elder_Support_Volunteer_Orgs.xlsx
Black Youth Project 100 (BYP100),Youth Abolitionist Organizing,South Side / Citywide,"National abolitionist organization of Black youth ages 18-35 headquartered in Chicago. BYP100 builds local and national abolitionist power through direct action, political education, and advocacy. The Chicago chapter is one of the most active, organizing campaigns around police accountability, decarceration, and Black queer feminist liberation.",byp100.org,,N/A (contact via byp100.org/contact),VERIFIED,2026-02-01,Relaunched digital platform in Feb 2026.,Chicago_Prison_Abolition_Solidarity_Volunteer_Orgs.xlsx
Chicago Books to Women in Prison (CBWP),Books & Arts in Prison,Uptown,"All-volunteer organization founded in 2002 that sends free books in all genres to incarcerated women and trans/nonbinary people nationwide. CBWP operates in solidarity with incarcerated people and believes access to books is a human right. Volunteers sort donated books, fulfill individual book requests, and pack boxes for mailing every Tuesday evening.",cbwp.org,,N/A (contact via cbwp.org),LIKELY_ACTIVE,2026-01-01,Continues sending packages and operating in 2026.,Chicago_Prison_Abolition_Solidarity_Volunteer_Orgs.xlsx
Chicago Community Bond Fund (CCBF),Prison Abolition & Advocacy,Citywide,"Abolitionist organization that paid bond for people charged with crimes in Cook County through a revolving fund. Since the Illinois Pretrial Fairness Act abolished money bond in September 2023, CCBF has pivoted to advocacy, political education, and community support work. Nearly 100 volunteers sustain their ongoing abolitionist work, fundraising, and community campaigns.",chicagobond.org,,info@chicagobond.org,INACTIVE,2023-12-01,Ceased posting bonds after IL abolished cash bail in late 2023.,Chicago_Prison_Abolition_Solidarity_Volunteer_Orgs.xlsx
Chicago Community Jail Support (CCJS),Community Jail Support / Mutual Aid,Little Village / Citywide,"Daily, on-the-ground grassroots mutual aid project run entirely by volunteers. CCJS meets people being released from Cook County Jail every day from 5–10 PM (11 PM on weekends) with warm clothing, snacks, drinks, PPE, safe transportation, and emergency housing connections. One of Chicago's most critical direct-aid volunteer projects for people exiting incarceration.",chicago-community-jail-support.webnode.page,,chicommunityjailsup@gmail.com,VERIFIED,2026-01-01,Supported by Blue Daring's 2026 'We're Doing Good' initiative.,Chicago_Prison_Abolition_Solidarity_Volunteer_Orgs.xlsx
Chicago Freedom School,Youth Abolitionist Organizing,South Loop,"Political and movement education organization co-empowering youth and adult allies in Chicago since 2008. Offers transformative leadership training, healing justice programming, and connections to abolitionist and social justice movements. Trains the next generation of organizers and advocates rooted in anti-carceral values.",chicagofreedomschool.org,,info@chicagofreedomschool.org,VERIFIED,2026-01-01,Applications opened for 2026 Freedom Fellowship.,Chicago_Prison_Abolition_Solidarity_Volunteer_Orgs.xlsx
826 Chicago,Youth Education / Creative Writing,Wicker Park,"Nonprofit creative writing and tutoring center supporting students ages 6–18 with after-school tutoring, field trips, and workshops.",826chi.org,,"1276 N Milwaukee Ave, Chicago, IL 60622 | Phone: 773-772-8108 | Email: info@826chi.org",VERIFIED,2026-06-29,Active tutoring/workshops; frequently referenced in 2026.,Initial Research_Chicago_Charitable_Organizations.xlsx
A Safe Haven,Housing / Multi-Service,West Side,"Provides transitional and permanent housing, job training, case management, and educational classes to homeless individuals and families.",asafehaven.org,,Website contact form available at asafehaven.org,VERIFIED,2026-05-01,Honored with 2026 philanthropy award; highlighted by Mayor in May 2026.,Initial Research_Chicago_Charitable_Organizations.xlsx
Anti-Cruelty Society,Animal Welfare,River North,"One of the nation's oldest humane societies; operates a shelter offering animal care, adoptions, youth volunteer programs (Kids Who Care, Youth Who Care), and humane education.",anticruelty.org,,"157 W Grand Ave, Chicago, IL 60654 | anticruelty.org/volunteer",VERIFIED,2026-06-29,Active 2026 events including Tour For Life.,Initial Research_Chicago_Charitable_Organizations.xlsx
Catholic Charities of the Archdiocese of Chicago,Multi-Service / Food,Near North Side,"Provides food pantries, emergency assistance, immigration services, senior care, and mental health support to vulnerable Chicagoans regardless of faith.",catholiccharities.net,,"721 N LaSalle St, Chicago, IL 60654 | catholiccharities.net",VERIFIED,2026-03-05,"Held Annual Virtual Investor Call on March 5, 2026.",Initial Research_Chicago_Charitable_Organizations.xlsx
Chicago Animal Care and Control (CACC),Animal Welfare / Animal Control,Pilsen,"City shelter providing stray and surrendered animal care; volunteers assist in enrichment, foster programs, and humane education with partner Safe Humane Chicago.",chicago.gov/cacc,,"2741 S Western Ave, Chicago, IL 60608 | chicago.gov/cacc",VERIFIED,2026-06-01,Permanent director appointed in early 2026; ongoing high intake operations.,Initial Research_Chicago_Charitable_Organizations.xlsx
Chicago Cares,Volunteer Coordination / Community,Citywide (South & West Side focus),"Connects volunteers to community-based organizations citywide; engages ~17,880 volunteers annually across 1,822+ service projects in neighborhoods like Englewood, Bronzeville, and Little Village.",chicagocares.org,,"1200 W 35th St, Suite 302, Chicago, IL 60609 | Phone: 312-780-0800 | chicagocares.org",VERIFIED,2026-07-18,Hosting 35th anniversary events in July 2026.,Initial Research_Chicago_Charitable_Organizations.xlsx
Chicago Commons,Early Childhood / Community Development,West Side (Multiple Locations),"Provides early childhood education, adult literacy, workforce development, and senior services across West Side communities.",chicagocommons.org,,Contact: MoutonM@ChicagoCommons.org | chicagocommons.org/volunteer,VERIFIED,2026-04-10,Hosted Spring Celebration Gala in April 2026.,Initial Research_Chicago_Charitable_Organizations.xlsx
Chicago Help Initiative,Food / Basic Needs,Citywide,"Volunteer-powered initiative providing food, clothing, and essential supplies to Chicagoans in need through pantry and outreach programs.",chicagohelpinitiative.org,,chicagohelpinitiative.org/blog/come-volunteer-with-us,VERIFIED,2026-02-08,Opened new center Jan 2026; hosted Winter Walk Feb 2026.,Initial Research_Chicago_Charitable_Organizations.xlsx
Chicago Lights,Education / Tutoring,Streeterville,Provides free tutoring and literacy support for Chicago youth using individualized attention from reading specialists; tutoring held in-person at Fourth Presbyterian Church.,chicagolights.org,,"126 E Chestnut St, Chicago, IL 60611 | Phone: 312-274-3828 | Email: tutor@chicagolights.org",VERIFIED,2026-06-11,Hosted Gala of Hope in March and Summer Soiree in June 2026.,Initial Research_Chicago_Charitable_Organizations.xlsx
Chicago Methodist Senior Services (CMSS),Senior Services,North Side,"Offers the most extensive senior services network on Chicago's North Side, including memory care assisted living, home care, adult day services, and low-income housing.",cmsschicago.org,,cmsschicago.org/services/senior-connections,VERIFIED,2026-09-24,Scheduled Fall Benefit for September 2026.,Initial Research_Chicago_Charitable_Organizations.xlsx
Chicago Park District,Environment / Parks,Citywide,"Manages 600+ parks; volunteers help with cleanups, planting, conservation projects, and special events across neighborhoods citywide.",chicagoparkdistrict.com/volunteer,,Email: groupvolunteers@chicagoparkdistrict.com | chicagoparkdistrict.com/volunteer,VERIFIED,2026-06-01,Actively recruiting for 2026 stewardship and clean-up days.,Initial Research_Chicago_Charitable_Organizations.xlsx
Chicago Parks Foundation,Environment / Parks,Citywide,"Supports Chicago's park system through Green Teams, It's Your Park Day cleanups, tree mulching, and enhancement projects running June through October.",chicagoparksfoundation.org,,chicagoparksfoundation.org/volunteer,VERIFIED,2026-06-27,"Hosted The Parks Gala on June 27, 2026.",Initial Research_Chicago_Charitable_Organizations.xlsx
Coppin Community Center,Youth / Community Development,Washington Park,"Social-service nonprofit at Coppin Memorial AME Church developing youth, supporting adults, and transforming quality of life for South Side residents.",coppincommunity.org,,"Washington Park neighborhood, Chicago | coppincommunity.org",VERIFIED,2026-06-01,Active food pantry and community hub operating in 2026.,Initial Research_Chicago_Charitable_Organizations.xlsx
Cradles to Crayons Chicago,Children / Families,Citywide,"Provides children in need with essential items—clothing, shoes, school supplies, and books—through volunteer-powered Giving Factory warehouse shifts.",cradlestocrayons.org/chicago,,cradlestocrayons.org/chicago/take-action/volunteer,VERIFIED,2026-07-11,Hosting Backpack-A-Thon events in July 2026.,Initial Research_Chicago_Charitable_Organizations.xlsx
Fight2Feed,Food Recovery,Citywide,"100% volunteer-driven nonprofit that recovers wasted food and turns it into healthy meals for people experiencing hunger, including direct street feeding.",fight2feed.org,,fight2feed.org,VERIFIED,2026-05-01,Participated in food rescue at 2026 National Restaurant Association Show.,Initial Research_Chicago_Charitable_Organizations.xlsx
Gads Hill Center,Youth / Community Development,Pilsen,"Provides after-school programs, early childhood education, workforce development, and community support services to Pilsen and Back of the Yards families.",gadshillcenter.org,,gadshillcenter.org,VERIFIED,2026-04-30,"Hosted 'Many Paths, One Dream' Gala in April 2026.",Initial Research_Chicago_Charitable_Organizations.xlsx
Greater Chicago Food Depository,Food Bank,Near West Side,"One of the Midwest's largest food banks, distributing 70M+ meals annually. Volunteers repack food, sort donations, and glean produce; shifts Tue–Sat.",chicagosfoodbank.org,,"4100 W Ann Lurie Pl, Chicago, IL 60632 | chicagosfoodbank.org/get-involved/volunteer",VERIFIED,2026-05-01,Hosted 38th Annual Chicago Commercial Real Estate Awards in May 2026.,Initial Research_Chicago_Charitable_Organizations.xlsx
Habitat for Humanity Chicago,Housing,Multiple Neighborhoods,Builds and rehabilitates affordable homes in partnership with low-income families; volunteers needed for construction sites and ReStore thrift stores.,habitatchicago.org,,habitatchicago.org/volunteer,VERIFIED,2026-06-09,Hosted Habitat Hero Award Dinner in June 2026.,Initial Research_Chicago_Charitable_Organizations.xlsx
Heartland Alliance,Multi-Service / Refugee Services,Citywide,"Provides housing, primary and dental health care, education, job training, legal aid, and refugee resettlement services to people in need.",heartlandalliance.org,,heartlandalliance.org,LIKELY_ACTIVE,2026-02-01,"Underwent restructuring/closures in 2026, but still operating specific health and international divisions.",Initial Research_Chicago_Charitable_Organizations.xlsx
Howard and Evanston Community Center,Community Development,Rogers Park,"Offers one-time, short-term, and long-term volunteer opportunities supporting community programs and neighborhood residents on Chicago's Far North Side.",howardevanston.org,,howardevanston.org/get-involved/volunteer,VERIFIED,2026-06-01,Published 2025/2026 Impact Reports and established Patton Family Mpower House.,Initial Research_Chicago_Charitable_Organizations.xlsx
Ignatian Volunteer Corps (IVC) Chicago,Volunteer Coordination / Community,West Loop,"Connects skilled, compassionate volunteers with trusted nonprofits in diverse service roles including food pantries, senior services, and administrative support.",ivcusa.org/ivc-offices/chicago,,"711 W Monroe St, Chicago, IL 60661 | Phone: 630-290-3857 | Email: chicago@ivcusa.org",VERIFIED,2026-06-01,Hosting ongoing volunteer info sessions in 2026.,Initial Research_Chicago_Charitable_Organizations.xlsx
Instituto del Progreso Latino,Education / Immigration Services,Pilsen,"Offers ESL, GED, citizenship, workforce development, and youth programs to support the educational and economic advancement of Latinx immigrants.",idpl.org,,"2570 S Blue Island Ave, Chicago, IL 60608 | Phone: 773-890-0055 | idpl.org",VERIFIED,2026-06-01,Actively accepting nursing applications in mid-2026.,Initial Research_Chicago_Charitable_Organizations.xlsx
Irving Park Community Food Pantry,Food Pantry,Irving Park,"Volunteer-run food pantry serving Irving Park and surrounding neighborhoods; needs help unloading trucks, packing/sorting food, client intake, and home deliveries.",ipcfp.org,,ipcfp.org,VERIFIED,2026-06-09,"Published 2026 distribution dates (including June 9, 2026).",Initial Research_Chicago_Charitable_Organizations.xlsx
Lincoln Park Community Services,Homeless Services,Lincoln Park,"Improves lives of neighbors experiencing homelessness through meal service, life skills teaching, and front-desk support at the Drop-In Program (weekdays 1–4 PM).",lpcschicago.org,,lpcschicago.org/get-involved,VERIFIED,2026-05-08,Hosted Annual Gala in May 2026.,Initial Research_Chicago_Charitable_Organizations.xlsx
Literacy Chicago,Adult Literacy / ESL,Loop / Citywide,"Trains volunteer tutors and teachers to provide ESL, citizenship prep, and adult literacy instruction to low-literate adults throughout Chicago.",literacychicago.org,,literacychicago.org/become-a-tutor.html,VERIFIED,2026-05-01,Published learner works in May 2026 and hosted gala.,Initial Research_Chicago_Charitable_Organizations.xlsx
LUCHA (Latinxs United for Change in Housing Action),Housing Advocacy / Community,Logan Square,"Bilingual nonprofit providing housing counseling, affordable housing advocacy, and community programming for Logan Square, Humboldt Park, and West Town residents.",lucha.org,,"3541 W North Ave, Chicago, IL 60647 | Phone: 773-276-5338 | Email: info@lucha.org",VERIFIED,2026-01-01,"Formal alliance with Association House announced late 2024, active into 2025/2026.",Initial Research_Chicago_Charitable_Organizations.xlsx
Mercy Home for Boys & Girls,Youth Services / Child Welfare,Near West Side,"Since 1887, provides safe homes, educational support, and career guidance to children who have experienced abuse, neglect, or violence; Friends First mentoring program.",mercyhome.org,,"1140 W Jackson Blvd, Chicago, IL 60607 | Phone: 877-637-2955 | mercyhome.org/ways-to-give/volunteer",VERIFIED,2026-01-01,Featured on WGN in Jan 2026; preparing for Aug 2026 Golf Classic.,Initial Research_Chicago_Charitable_Organizations.xlsx
