name,category,neighborhood,description,website,social_media,contact_info,verification_status,last_verified_activity,verification_evidence,source
Prison + Neighborhood Arts/Education Project (PNAP),Books & Arts in Prison,Uptown,"Arts and education project rooted in solidarity between communities inside and outside prison. PNAP brings teaching artists, educators, and community organizers into Illinois prisons to run workshops and programming, and builds bridges between incarcerated people and Chicago neighborhoods. Partners with academic institutions and Chicago arts community for sustained creative collaboration.",p-nap.org,,contactpnap@gmail.com,VERIFIED,2026-01-01,Ongoing advocacy and academic references in 2026.,Chicago_Prison_Abolition_Solidarity_Volunteer_Orgs.xlsx
Restore Justice Foundation,Legal Advocacy / Law Reform,Loop,"Chicago-based nonprofit working to reform sentencing laws, improve prison conditions, and expand pathways to release for Illinois prisoners — especially those serving lengthy or life sentences. Focuses on legislative advocacy, public education, and direct support to impacted individuals and families. Volunteers support advocacy, communications, and organizing.",restorejustice.org,,hello@restorejustice.org,VERIFIED,2026-01-01,Active in 2026 legislative sessions.,Chicago_Prison_Abolition_Solidarity_Volunteer_Orgs.xlsx
Safer Foundation,Reentry Support,Near West Side / Southwest Side,"One of the nation's largest nonprofit social impact organizations focused on human capital development for people with arrest and conviction records. Operating in Chicago since 1972, Safer Foundation provides comprehensive reentry services including employment, education, housing support, and mental health services. Welcomes volunteers at all Chicago-area locations.",saferfoundation.org,,N/A (contact via saferfoundation.org),VERIFIED,2026-04-28,"Awarded $2.2M grant early 2026, CARRE Policy Conference scheduled April 28, 2026.",Chicago_Prison_Abolition_Solidarity_Volunteer_Orgs.xlsx
Transformative Justice Law Project of Illinois (TJLP),Legal Advocacy / Abolitionist,Uptown,"Collective of radical lawyers, social workers, activists, and community organizers deeply committed to prison abolition, transformative justice, and gender self-determination. TJLP provides legal support for transgender and gender non-conforming people involved in the criminal legal system, including name changes, defense, and post-conviction work. Volunteers assist with legal clinics and client support.",tjlp.org,,info@tjlp.org,VERIFIED,2026-04-01,Hosted name change mobilizations in April 2026.,Chicago_Prison_Abolition_Solidarity_Volunteer_Orgs.xlsx
Transforming Reentry Services / MWIPM,Reentry Support,Douglas / East Garfield Park,"Direct service organization (formerly Men & Women In Prison Ministries) providing comprehensive reentry services to people returning from incarceration, including case management, harm reduction, health and wellness programming, and connection to housing and employment. Operates on both Chicago's South Side and West Side and seeks volunteers for direct service and major events.",transformingreentry.org,,info@transformingreentry.org,VERIFIED,2026-01-01,Active in 2026 Supportive Reentry Network Collaborative.,Chicago_Prison_Abolition_Solidarity_Volunteer_Orgs.xlsx
Catholic Charities of Chicago — Immigrant Services,Refugee Resettlement / Immigrant Services,Albany Park,"Department of Justice-accredited program providing comprehensive refugee resettlement, immigration legal services, case management, employment services, school placement, and family reunification support for immigrants and refugees across Chicago.",catholiccharities.net,,N/A (contact via website),VERIFIED,2026-01-01,"Continues immigrant services, though discontinued refugee resettlement in 2025.",Chicago_Migrant_Immigrant_Support_Volunteer_Orgs.xlsx
Centro Romero,Immigrant Community Services / Education,Edgewater,"Serves Chicago's immigrant and refugee populations as 'the voice of the voiceless.' Provides adult ESL, GED in Spanish, citizenship/naturalization workshops, women's empowerment programming, after-school tutoring, domestic violence counseling, and legal services.",centroromero.org,,aevolunteer@centroromero.org,VERIFIED,2026-05-01,Hosted 'Together for Health' Annual Health Fair in May 2026.,Chicago_Migrant_Immigrant_Support_Volunteer_Orgs.xlsx
Ethiopian Community Association of Chicago (ECAC),East African Immigrant Services,Uptown,"Provides culturally specific services to East African immigrants and refugees in Chicago, including immigration assistance, English language classes, job placement services, and community integration support.",N/A (contact directly),,N/A (contact via phone),VERIFIED,2026-08-22,Pickleball fundraising event scheduled for August 2026.,Chicago_Migrant_Immigrant_Support_Volunteer_Orgs.xlsx
HIAS Chicago (Jewish Child & Family Services),Refugee Resettlement / Family Welcome,Loop,"HIAS Chicago, operated through JCFS, provides refugee resettlement, immigration and citizenship services, and co-sponsorship programs. Volunteer welcome teams visit newcomer families for at least six months, assisting with English practice, public transportation, grocery shopping, and community navigation.",jcfs.org/hias,,"N/A (contact Fatima Rasoul, Community Engagement: 847-745-5431)",VERIFIED,2026-02-15,"Offered 2026/2027 college scholarships, applications through Feb 2026.",Chicago_Migrant_Immigrant_Support_Volunteer_Orgs.xlsx
Heartland Human Care Services — Refugee & Immigrant Community Services (RICS),Refugee Resettlement / Trauma Support,Ravenswood,"Partners with refugees, asylees, immigrants, and survivors of trafficking to provide resettlement support, adult ESL, employment services, young adult mentoring, and specialized care for survivors of torture and trauma.",heartlandhumancareservices.org,,volunteer@heartlandhumancareservices.org,LIKELY_ACTIVE,2026-01-01,"Closed shelters for unaccompanied minors in early 2026, but RICS program historically maintained.",Chicago_Migrant_Immigrant_Support_Volunteer_Orgs.xlsx
ICDI (Illinois Community for Displaced Immigrants),Asylum Seeker Support / Case Management,Loop,Formerly Interfaith Community for Detained Immigrants (renamed 2023). Provides trauma-informed case management and essential goods for asylum seekers and displaced immigrants in Chicago. Offers personalized support to individuals and families navigating the immigration system.,icdichicago.org,,hello@icdichicago.org,VERIFIED,2026-06-01,Active as of June 2026 providing services.,Chicago_Migrant_Immigrant_Support_Volunteer_Orgs.xlsx
MIRA Chicago (Middle Eastern Immigrant & Refugee Alliance),Middle Eastern Refugee & Immigrant Services,North Side / Lincolnwood,"Fosters well-being and self-sufficiency of Middle Eastern refugees, immigrants, and asylees. Provides culturally competent and trauma-informed services for those from the Middle East and Islamic cultures, including legal services, case management, and community programming.",mirachicago.org,,N/A (contact via website),VERIFIED,2026-01-01,Active DOJ accreditation renewals as of early 2026.,Chicago_Migrant_Immigrant_Support_Volunteer_Orgs.xlsx
Refugee FORA (Forging Opportunities for Refugees in America),Refugee Education / Youth Tutoring,West Ridge,High-impact tutoring nonprofit for refugee students with limited or interrupted formal educations (SLIFE). Volunteers provide individualized academic tutoring and mentorship to help refugee youth succeed in Chicago public schools.,refugeefora.org,,info@refugeefora.org,VERIFIED,2026-01-01,Actively recruiting for Fall 2026 internships.,Chicago_Migrant_Immigrant_Support_Volunteer_Orgs.xlsx
RefugeeOne,Refugee Resettlement / Integration,West Rogers Park,"Chicago's largest refugee resettlement agency, serving over 2,500 refugees, asylum seekers, and immigrants annually since 1982. Provides housing placement, English classes, employment services, mental health counseling, legal assistance, and long-term integration support.",refugeeone.org,,volunteer@refugeeone.org,VERIFIED,2026-01-01,Hosted 2026 'Legacy of Welcome' benefit.,Chicago_Migrant_Immigrant_Support_Volunteer_Orgs.xlsx
The Resurrection Project / TRP Immigrant Justice,Immigrant Legal Services / Community Organizing,Pilsen,"Longstanding Pilsen-based community organization with a dedicated Immigrant Justice division. Runs weekly pro se immigration legal assistance workshops, DACA renewal clinics, naturalization workshops, and community organizing to protect immigrant rights.",trpimmigrantjustice.org,,N/A (volunteer form on website),VERIFIED,2026-01-01,Launched Illinois Attorney Panel Program in Jan 2026.,Chicago_Migrant_Immigrant_Support_Volunteer_Orgs.xlsx
World Relief Chicagoland,Refugee Resettlement / ESL / Employment,Albany Park,"International faith-based humanitarian organization with a major Chicago hub. Provides comprehensive refugee resettlement including housing, ESL classes, employment support, immigration legal services, and long-term integration programming for refugees and immigrants.",worldrelief.org/chicagoland,,volunteerchicagoland@wr.org,VERIFIED,2026-01-01,Participated in 2026 Health Equity Summit.,Chicago_Migrant_Immigrant_Support_Volunteer_Orgs.xlsx
Young Center for Immigrant Children's Rights,Unaccompanied Immigrant Children / Child Advocacy,Near South Side,Advocates for the best interests of unaccompanied immigrant children in U.S. immigration proceedings. Volunteer Child Advocates are appointed by immigration judges to represent each child's interests independent of legal and government parties.,theyoungcenter.org,,info@theyoungcenter.org,VERIFIED,2026-03-01,Published Spring 2026 Impact Report.,Chicago_Migrant_Immigrant_Support_Volunteer_Orgs.xlsx
Cabrini Green Legal Aid (CGLA),Legal Aid / Housing Rights,Citywide,"Provides no-cost legal assistance to 5,600+ low-income Chicagoans/year in housing, criminal records, and civil matters. Pro bono attorneys receive training and case support across multiple practice areas.",https://www.cgla.net,,volunteer@cgla.net,VERIFIED,2026-01-01,Active organization in Chicago as of 2026.,Chicago_Food_Security_Community_Dev_Orgs.xlsx
Chicago Area Project (CAP),Youth / Workforce Development,Citywide,"Est. 1934, one of the nation's oldest delinquency prevention organizations. Runs youth empowerment, mentoring, vocational training, entrepreneurship, and financial literacy programs across Chicago neighborhoods.",https://www.chicagoareaproject.org,,info@chicagoareaproject.org,VERIFIED,2026-02-01,Partnered with 'Our Rescue' for youth training in Feb 2026.,Chicago_Food_Security_Community_Dev_Orgs.xlsx
Growing Home Inc.,Urban Agriculture / Workforce Development,Englewood,"USDA-Certified Organic urban farm and workforce development center. Provides paid employment training to Chicagoans 18+ facing barriers, while producing local healthy food for Englewood residents.",https://www.growinghomeinc.org,,info@growinghomeinc.org,VERIFIED,2026-05-07,"Hosted 24th Annual Benefit on May 7, 2026.",Chicago_Food_Security_Community_Dev_Orgs.xlsx
Neighborhood Housing Services (NHS) Chicago,Affordable Homeownership,"Multiple Locations (Central, West Humboldt Park, Chatham)","Est. 1975, empowers Chicagoans to buy, fix, and keep their homes through affordable loans, grants, homebuyer education, and neighborhood revitalization events (NeighborWorks Day).",https://nhschicago.org,,homeownership@nhschicago.org,VERIFIED,2026-06-01,Launched HomeGrown Purchase Assistance Program in June 2026.,Chicago_Food_Security_Community_Dev_Orgs.xlsx
Rebuilding Together Metro Chicago,Home Repair / Neighborhood Revitalization,Citywide (focus: low-income neighborhoods),"All-volunteer labor force providing free home repair and rehabilitation to elderly, disabled, and low-income homeowners so they can remain in their homes safely and comfortably.",http://www.rebuildingtogether-chi.com,,Via volunteer form at rebuildingtogether-chi.com/volunteer-,VERIFIED,2026-04-25,"Celebrated 35th anniversary of National Rebuilding Day on April 25, 2026.",Chicago_Food_Security_Community_Dev_Orgs.xlsx
Autonomous Tenants Union,Tenant Rights & Advocacy,Citywide,All-volunteer organization committed to housing justice through independent tenant organizing across Chicago neighborhoods. Works to build collective tenant power outside of formal nonprofit structures.,autonomoustenantsunion.org,,contact via website,VERIFIED,2026-01-01,Continues its work advocating for housing justice as of 2026.,Chicago_Housing_Justice_Volunteer_Orgs.xlsx
Deborah's Place,Supportive Housing (Women),East Garfield Park / Citywide,"Largest provider of permanent supportive housing in Chicago exclusively for unaccompanied women. Founded by volunteers in 1985; two program locations with 200+ housing units. Helps women experiencing homelessness heal, set goals, and achieve stability.",deborahsplace.org,,volunteer@deborahsplace.org,LIKELY_ACTIVE,2026-01-01,Active but facing funding challenges in early 2026.,Chicago_Housing_Justice_Volunteer_Orgs.xlsx
Housing Opportunities for Women (HOW),Supportive Housing (Women & Families),Citywide,"Since 1983, addresses homelessness for women, children, and families using the Housing First model. Manages 374 apartments and houses 400+ children; offers wellness services, children/youth programs, financial education, and support groups.",how-inc.org,,contact via how-inc.org,LIKELY_ACTIVE,2026-01-01,Active but navigating funding challenges in early 2026.,Chicago_Housing_Justice_Volunteer_Orgs.xlsx
Law Center for Better Housing (LCBH),Eviction Defense / Legal Aid,Loop / Citywide,Chicago's ONLY legal-aid organization focused solely on housing justice. Provides free legal assistance and supportive services to low- and moderate-income renters facing eviction. Operates the Rentervention program connecting renters with volunteer attorneys.,lcbh.org,,volunteer@lcbh.org,VERIFIED,2026-10-15,"2026 Annual Fall Benefit scheduled for Oct 15, 2026.",Chicago_Housing_Justice_Volunteer_Orgs.xlsx
Mercy Housing Lakefront,Affordable Housing / Supportive Housing,Citywide (28 properties across Illinois),"Manages 28 rental properties housing 4,000+ people in Illinois and Wisconsin. Provides affordable and supportive housing for low-income families, seniors, and individuals, combined with educational programs and resident services to help residents achieve stability.",mercyhousing.org/lakefront,,contact via mercyhousing.org/lakefront,VERIFIED,2026-04-01,Funding secured for rehabilitation of Leland Apartments as of April 2026.,Chicago_Housing_Justice_Volunteer_Orgs.xlsx
NHS Chicago (Neighborhood Housing Services of Chicago),Homeownership / Foreclosure Prevention,Citywide (West Loop HQ),"Since 1975, helps Chicago residents buy, fix, and keep their homes. Provides homebuyer education, foreclosure intervention counseling, and neighborhood revitalization. Has served 219,000+ families through partnerships with insurance companies, financial institutions, and community residents.",nhschicago.org,,homeownership@nhschicago.org,VERIFIED,2026-06-01,Launched HomeGrown Purchase Assistance Program in June 2026.,Chicago_Housing_Justice_Volunteer_Orgs.xlsx
Northside Housing & Support Services (NSHSS),Homeless Services / Emergency Shelter,Rogers Park / Uptown,"Ends homelessness through emergency shelter, permanent housing, and comprehensive supportive services. Operates emergency shelter at Rogers Park. Volunteer meal shifts available Sun–Fri 4–7PM and Friday mornings 10AM–1PM. Must be 14+ to enter kitchen.",northsidehousing.org,,development@northsidehousing.org,VERIFIED,2026-01-01,Newly opened Rogers Park shelter operating in 2026.,Chicago_Housing_Justice_Volunteer_Orgs.xlsx
Pilsen Alliance,Community Organizing / Anti-Displacement,Pilsen / Lower West Side,"Develops working-class power through community education, leadership development, and policy advocacy to prevent displacement and preserve affordable housing in Pilsen. Fights gentrification and advocates for long-term residents' right to stay in their neighborhood.",pilsenalliance.org,,contact via pilsenalliance.org,VERIFIED,2026-01-01,Active in anti-gentrification efforts in 2026.,Chicago_Housing_Justice_Volunteer_Orgs.xlsx
Sarah's Circle,Homeless Services (Women),Uptown,"Ends homelessness for women through emergency shelter, interim housing, supportive housing, clinical services, and educational programming. Founded 1979 by three friends; volunteers have been essential since day one. Offers opportunities weekly for individuals and groups.",sarahs-circle.org,,volunteer@sarahs-circle.org,VERIFIED,2026-03-08,"Hosted Winter Walk event on March 8, 2026.",Chicago_Housing_Justice_Volunteer_Orgs.xlsx
Street Samaritans,Street Outreach / Housing Navigation,Citywide,"Uses a relationship-based, trauma-informed approach to help people exit homelessness. Provides direct street outreach, individualized case management, housing placement, mental health referrals, public benefits enrollment. Meets people where they are — on streets, in libraries, and through community partnerships.",streetsamaritans.org,,contact via streetsamaritans.org,VERIFIED,2025-07-01,Conducted 2025 Homelessness Needs Assessment in July 2025,Chicago_Housing_Justice_Volunteer_Orgs.xlsx
Ascend Justice,Domestic Violence Legal Aid,Loop,"Provides free civil legal services to survivors of gender-based violence throughout Cook County. Runs an Emergency Order of Protection Clinic at the Domestic Violence Courthouse, helping survivors obtain legal protection.",ascendjustice.org,,volunteerservices@ascendjustice.org,VERIFIED,2026-06-01,"Engaged in advocacy regarding ICE in courthouse 2026, CAN Hope partnership Nov 2025",Chicago_Legal_Aid_Community_Law_Volunteer_Orgs.xlsx
CARPLS (Coordinated Advice & Referral Program for Legal Services),Legal Aid Hotline,Loop,"Provides immediate telephone legal advice and referrals to low-income Cook County residents on everyday civil legal problems, handling over 30,000 cases per year. Operates a legal aid hotline and evening/daytime volunteer shifts.",carpls.org,,lwallin@carpls.org,VERIFIED,2026-06-29,Hosted annual Golden Gavel Gala; active everyday justice blog,Chicago_Legal_Aid_Community_Law_Volunteer_Orgs.xlsx
Chicago Appleseed Center for Fair Courts,Court Reform & Policy Advocacy,Streeterville,"Community-driven advocacy organization using research to interrupt cycles of poverty, mass incarceration, and racial injustice in the legal system. Runs volunteer court-watching and policy research committees on criminal justice, immigration courts, police accountability, and access to justice.",chicagoappleseed.org,,faircourts@chicagoappleseed.org,VERIFIED,2026-04-13,Announced new Executive Director Rachel Lyons in April 2026; released reports in May 2026,Chicago_Legal_Aid_Community_Law_Volunteer_Orgs.xlsx
Chicago Lawyers' Committee for Civil Rights (CLCCRUL),Civil Rights Advocacy & Pro Bono,Loop,"Mobilizes hundreds of volunteer attorneys to provide thousands of hours of legal assistance to clients facing civil rights violations in housing, education, voting rights, and economic access. Works with law firms on pro bono partnerships and matches volunteer lawyers with individual clients.",clccrul.org,,probonoworks@clccrul.org,VERIFIED,2026-06-01,Filed Indiana lawsuit in June 2026; hosted June 2026 civil rights workshop,Chicago_Legal_Aid_Community_Law_Volunteer_Orgs.xlsx
Greater Chicago Legal Clinic,Civil Legal Aid,Loop,"Provides affordable civil legal services to low- and moderate-income individuals and families. Covers a wide range of case types including domestic violence, guardianships, foreclosure defense, and criminal records, with opportunities for attorneys, paralegals, law students, and non-legal volunteers.",gclclaw.org,,info@gclclaw.org,VERIFIED,2026-06-29,Active virtual appointment bookings and legal services,Chicago_Legal_Aid_Community_Law_Volunteer_Orgs.xlsx
Illinois Legal Aid Online (ILAO),Digital Legal Aid / Technology,Loop,"Online nonprofit that provides clear legal information, forms, and self-help tools for civil legal issues to Illinois residents. Connects eligible residents with lawyers and legal aid organizations statewide. Maintains the largest free legal help website in Illinois.",illinoislegalaid.org,,tsimmons@illinoislegalaid.org,VERIFIED,2026-05-01,25th anniversary benefit scheduled for Oct 2026; launched AI tools in May 2026,Chicago_Legal_Aid_Community_Law_Volunteer_Orgs.xlsx
Legal Aid Society of Metropolitan Family Services,Family Law Legal Aid,Loop/West Loop,"Legal arm of Metropolitan Family Services, providing free civil legal assistance to low-income individuals and families in the Chicago metropolitan area. Focuses on family law, housing, domestic violence, immigration, and public benefits matters.",laschicago.org,,contactus@metrofamily.org,VERIFIED,2025-11-01,Received grant funding in late 2025; Executive Director continued service in 2025,Chicago_Legal_Aid_Community_Law_Volunteer_Orgs.xlsx
Mandel Legal Aid Clinic (UChicago Law),Law School Legal Clinic,Hyde Park,"Edwin F. Mandel Legal Aid Clinic at the University of Chicago Law School. Law students provide free civil legal services under attorney supervision in areas including civil rights and police accountability, immigration, housing, and federal criminal defense.",law.uchicago.edu/clinics/mandel,,N/A (contact via website),VERIFIED,2026-06-29,Active through the University of Chicago Law School news and clinical program pages,Chicago_Legal_Aid_Community_Law_Volunteer_Orgs.xlsx
Uptown People's Law Center,Housing & Prisoner Rights Legal Aid,Uptown,"Provides free legal assistance on housing (evictions, habitability, foreclosures) and prisoner rights matters to low-income individuals in the Chicago area. Walk-in hours on Tuesdays and Thursdays. Primarily serves North Side neighborhoods and also provides legal resources for incarcerated individuals.",uplcchicago.org,,N/A (contact via website),VERIFIED,2026-02-01,Published 'Know Your Rights' guide in Feb 2026,Chicago_Legal_Aid_Community_Law_Volunteer_Orgs.xlsx
Austin Coming Together (ACT),Collective Impact / Neighborhood Advocacy,Austin / West Side,"Backbone organization for 50+ nonprofits, faith institutions, and public entities in Chicago's Austin community; coordinates collective action on safety, economic development, education, and health equity. Volunteer task force members help implement the Austin community plan.",austincomingtogether.org,,"5049 W Harrison St, Chicago, IL 60644 | Phone: 773-417-8601 | Volunteer contact: gcooper@austincomingtogether.org | austincomingtogether.org",VERIFIED,2026-06-24,"Acquired historic J.J. Walser House on June 24, 2026",Chicago_Community_Advocacy_Organizations.xlsx
Bronzeville Community Development Partnership (BCDP),Community / Economic Development,Bronzeville,"Leads preservation, tourism, technology, and transportation initiatives in Chicago's historic Black Metropolis National Heritage Area; partners with residents and institutions to advance economic growth and cultural heritage in Bronzeville.",bronzevillepartners.com,,"3473 S King Dr, Suite 512, Chicago, IL 60616 | bronzevillepartners.com",VERIFIED,2026-04-01,Received SBIF support in Jan 2026; filed Form 990 in April 2026,Chicago_Community_Advocacy_Organizations.xlsx
BUILD Chicago (Broader Urban Involvement & Leadership Development),Youth Development / Community Advocacy,Austin / West Side,"Provides intensive mentoring, gang intervention, and violence prevention for Chicago's most at-risk youth on the West Side; volunteers sort donated goods, support gardens, tutor students, organize school supply drives, clean parks, and assist community events.",buildchicago.org,,"5100 W Harrison St, Chicago, IL 60644 | Phone: 773-227-2880 | Email: build@buildchicago.org | buildchicago.org/donate-volunteer/volunteers",VERIFIED,2026-06-27,Hosted Career Fair June 2026 and Restorative Justice Conf May 2026,Chicago_Community_Advocacy_Organizations.xlsx
Developing Communities Project (DCP),Faith-Based / Community Organizing,Southeast Chicago (Roseland / Pullman),"Faith-based community organization founded in 1984 in response to Southeast Side plant closings; builds collective power among residents through leadership development, civic participation, and advocacy on housing, jobs, and neighborhood stability.",developingcommunitiesproject.org,,Southeast Chicago | developingcommunitiesproject.org,UNCERTAIN,2026-06-01,Appears mostly in historical contexts regarding Obama Center 2026 opening; active programs unclear,Chicago_Community_Advocacy_Organizations.xlsx
Far South Community Development Corporation (Far South CDC),Community / Economic Development,"Far South Side (Roseland, Morgan Park, Pullman, Riverdale)","One of the largest comprehensive community development organizations on Chicago's Far South Side; provides housing development, business assistance, and equitable planning services while advocating for economic, environmental, and social justice in underserved Far South communities.",farsouthcdc.org,,farsouthcdc.org,VERIFIED,2026-06-01,Launched West Pullman Grocery Store initiative in June 2026; hosted April 2026 housing fair,Chicago_Community_Advocacy_Organizations.xlsx
Good Kids Mad City (GKMC) – Englewood,Youth Advocacy / Peace Building,Englewood / West Englewood,"Youth-led organization fighting gun violence through community organizing, peace-keeping initiatives, and the Peace Book Ordinance—which would fund young people to work as neighborhood peacekeepers. Volunteers support events, outreach, and youth organizing.",gkmcenglewood.com,,"Englewood, Chicago | gkmcenglewood.com | Facebook: /GoodKidsMadCity",VERIFIED,2026-06-01,Hosted Englewood Youth Empowerment Takeover in June 2026,Chicago_Community_Advocacy_Organizations.xlsx
