name,category,neighborhood,description,website,social_media,contact_info,verification_status,last_verified_activity,verification_evidence,source
South Loop Mutual Aid,General Mutual Aid / Food & Essentials,South Loop,"Neighborhood volunteer network providing food, supplies, and financial assistance to South Loop residents; aid requests submitted via online form.",forms.gle/npoXhXUQbQXwSez29,,Phone: 708-953-8481 | Email: southloopmutualaid@gmail.com | Request aid: forms.gle/npoXhXUQbQXwSez29,VERIFIED,2026-01-01,Active listings and request forms as of late 2025 and early 2026.,Initial Research_Chicago_Mutual_Aid_Groups.xlsx
Ukrainian Village Mutual Aid,General Mutual Aid / Food & Essentials,Ukrainian Village,"Neighbor-to-neighbor mutual aid network in Ukrainian Village offering food, supplies, and community support to residents in need.",ukvmutualaid.com,,Phone: 312-298-9328 | Email: ukrainianvillagemutualaid@gmail.com | ukvmutualaid.com,VERIFIED,2026-01-01,Remains active and listed in 2026 mutual aid directories.,Initial Research_Chicago_Mutual_Aid_Groups.xlsx
Wicker Park – Bucktown Mutual Aid,General Mutual Aid / Food & Essentials,Wicker Park / Bucktown,Volunteer-run neighborhood network collecting and distributing donated food and essential goods to Wicker Park and Bucktown neighbors in need; operates from a Logan Square warehouse.,wickerparkmutualaid.org,,"Warehouse: 2828 N Pulaski Rd, Gate 218, Chicago, IL 60641 | Phone: 773-273-9640 | wickerparkmutualaid.org",VERIFIED,2026-01-01,Continues to be cited in community resource directories as an active network.,Initial Research_Chicago_Mutual_Aid_Groups.xlsx
Adler Planetarium,Museum,Near South Side (Museum Campus),"Volunteers engage guests on the museum floor, facilitate telescope viewing at daytime and special events, and help behind the scenes with data entry and clerical work. Minimum age 18.",adlerplanetarium.org/support/volunteers,,"1300 S Lake Shore Dr, Chicago, IL 60605",VERIFIED,2026-02-14,Hosted a Valentine’s-themed event in February 2026; fully open.,Chicago_Arts_Culture_Organizations.xlsx
Art Institute of Chicago,Museum,Loop,Gallery Volunteers engage visitors and discuss artworks; Special Projects Volunteers support the Artist's Studio and events; Student Experience Volunteers support K-12 group visits. Requires two half-day trainings plus a role-specific session.,artic.edu/careers/volunteer-opportunities,,"111 S Michigan Ave, Chicago, IL 60603",VERIFIED,2026-06-14,"Hosting major exhibitions in 2026, including Willem de Kooning Drawing.",Chicago_Arts_Culture_Organizations.xlsx
Chicago Architecture Center (CAC),Museum / Education,Loop,"Trained volunteer docents lead public tours, including the popular architecture river cruise, after completing a 14-week training course; about 1,000 active volunteers.",architecture.org,,"111 E Wacker Dr, Chicago, IL 60601",VERIFIED,2026-04-13,Hosting 'Currents: 60 Years of CAC' exhibition opening April 2026.,Chicago_Arts_Culture_Organizations.xlsx
Chicago Humanities Festival,Festival / Performing Arts,Citywide (multiple venues),"Volunteers support 100+ annual events across the city, including book signings, performances, and audience experience, for one of the longest-running festivals of arts and ideas in the US.",chicagohumanities.org/about/volunteer,,Via website contact form,VERIFIED,2026-04-18,Spring 2026 Festival ran from April through mid-June.,Chicago_Arts_Culture_Organizations.xlsx
DCASE (Dept. of Cultural Affairs & Special Events),City Cultural Programming,Loop,"Volunteers connect visitors with cultural sites like Millennium Park, the Chicago Cultural Center, Clarke House Museum, and Taste of Chicago - leading tours, providing info, greeting, and wayfinding.",chicago.gov/dcase,,"78 E Washington St, Chicago, IL 60602",VERIFIED,2026-06-01,Launched Next Stage Chicago funding initiative in June 2026.,Chicago_Arts_Culture_Organizations.xlsx
Field Museum,Museum,Near South Side (Museum Campus),"Volunteer roles support exhibits, education programs, and visitor services; application requires a resume, cover letter, and three professional references.",fieldmuseum.org,,"1400 S Lake Shore Dr, Chicago, IL 60605",VERIFIED,2026-05-22,Pokémon Fossil Museum exhibition debuted in May 2026.,Chicago_Arts_Culture_Organizations.xlsx
Goodman Theatre,Theater,Loop,"Volunteer ushers read and tear tickets, direct patrons to seats, help distribute programs, and assist with lobby wayfinding; ushers receive free admission to the production they work.",goodmantheatre.org,,Email: Ushering@GoodmanTheatre.org,VERIFIED,2026-06-20,Hosting 'Iceboy!' in summer 2026 as part of Centennial Season.,Chicago_Arts_Culture_Organizations.xlsx
Lyric Opera of Chicago,Opera / Performing Arts,Loop (Civic Opera House),"Volunteers lead student tours of the Lyric Opera House as Lyric Guides, support 'Opera in the Neighborhoods' community events, and participate in local Chapter volunteer activities.",lyricopera.org/about/get-involved/volunteer,,"20 N Wacker Dr, Chicago, IL 60606",VERIFIED,2026-01-01,Operating its 2025/2026 season with various performances.,Chicago_Arts_Culture_Organizations.xlsx
Museum of Contemporary Art (MCA) Chicago,Museum,Near North Side / Streeterville,"Volunteers help at evening events, support Family Days with the Learning and Public Programs department, usher for MCA Stage performances, and lead exhibition tours.",mcachicago.org/about/volunteering,,"220 E Chicago Ave, Chicago, IL 60611",VERIFIED,2026-05-02,Hosting 'Chicago Works | Mike Cloud' starting May 2026.,Chicago_Arts_Culture_Organizations.xlsx
Shedd Aquarium,Museum / Aquarium,Near South Side (Museum Campus),"Volunteers support front-of-house and behind-the-scenes roles, above and below water, matched to skills, interests, and availability. Welcomes volunteers from all backgrounds.",sheddaquarium.org/about-shedd/volunteer,,"1200 S Lake Shore Dr, Chicago, IL 60605",VERIFIED,2026-04-01,Opening new 4D Immersion Theater in Spring 2026.,Chicago_Arts_Culture_Organizations.xlsx
Stage 773,Theater,Lakeview,Neighborhood theater venue; check directly for usher and volunteer support roles for performances and events.,stage773.com,,"1225 W Belmont Ave, Chicago, IL 60657, (773) 929-7367",INACTIVE,2022-01-01,Permanently closed and slated for redevelopment into residential complex.,Chicago_Arts_Culture_Organizations.xlsx
Steppenwolf Theatre Company,Theater,Lincoln Park,"Volunteers serve as ushers for mainstage and LookOut performances, sighted guides for Audio Description/Touch Tour shows, and ASL-interpretation ushers; ongoing sign-ups year round.",steppenwolf.org/about-us/work-with-us/volunteering,,"1650 N Halsted St, Chicago, IL 60614, Email: volunteers@steppenwolf.org",VERIFIED,2026-01-29,Hosted 'Topdog/Underdog' in early 2026 for its 50th Anniversary season.,Chicago_Arts_Culture_Organizations.xlsx
Swedish American Museum,Cultural Heritage Museum,Andersonville,"Seeks volunteers for cultural events such as Midsommarfest, a weekend celebration of Swedish music, food, and traditions.",swedishamericanmuseum.org,,"5211 N Clark St, Chicago, IL 60640",VERIFIED,2026-04-19,Kicked off its 50th anniversary celebration in April 2026.,Chicago_Arts_Culture_Organizations.xlsx
The Saints,Performing Arts / Theater Support,Citywide (multiple venues),"Volunteer organization whose members usher at theaters throughout Chicago and the suburbs, handing out programs and collecting tickets in exchange for free admission.",saintschicago.org,,Via website,VERIFIED,2026-01-01,Actively recruiting volunteers for the 2025/2026 performing arts season.,Chicago_Arts_Culture_Organizations.xlsx
The Volunteer Center - Arts & Culture,Volunteer Matching Platform,North Shore / NE Metro Chicago,"Connects volunteers with opportunities to help at local theaters, support museum exhibits, and work behind the scenes at festivals across the region.",volunteercenterhelps.org/arts---culture,,Via website,VERIFIED,2026-06-29,"Ongoing, active in 2026 coordinating Days of Service and maintaining directories.",Chicago_Arts_Culture_Organizations.xlsx
American Indian Association of Illinois (AIAI),Education & Youth Services,Rogers Park,"Founded 2007; Native-governed, Native-serving nonprofit dedicated to transforming Chicago American Indian communities through education, leadership development, culture, history, social justice, and policy reform. Provides academic/social support and financial planning to students and families. Utilizes community volunteers working with youth, elders, and families.",chicago-american-indian-edu.org,,aiaillinois@aol.com,VERIFIED,2026-01-01,Working with Illinois Humanities for America 250 programming in 2026.,Chicago_Indigenous_Solidarity_Volunteer_Orgs.xlsx
American Indian Center of Chicago (AIC),Cultural Center & Community Hub,Albany Park,"Established 1953 — the first urban Indian Center in the country. Founded to support Natives who relocated to Chicago under the U.S. government's relocation program. Today offers cultural, social, and educational services including monthly community potlucks, senior lunches, weekly drum practice, open beadwork classes (Tue & Thu 4–7PM), and gallery programming.",aicchicago.org,,info@chicagoaic.org,VERIFIED,2026-02-01,Hosted community gatherings such as the Sweetheart Round Dance in February 2026.,Chicago_Indigenous_Solidarity_Volunteer_Orgs.xlsx
American Indian Health Service of Chicago (AIHSC),Indigenous Healthcare & Behavioral Health,Albany Park,"Federally qualified health center providing culturally competent healthcare to the American Indian/Alaska Native community and other underserved populations since 1975. Services include family practice, behavioral health (therapy, peer support, talking circles), diabetes program, HIV testing, domestic violence prevention, suicide prevention, and substance use disorder treatment.",aihschgo.org,,contact via aihschgo.org/contact-us,VERIFIED,2026-06-01,Recognized as a grant recipient in June 2026.,Chicago_Indigenous_Solidarity_Volunteer_Orgs.xlsx
CPS American Indian Education Program,Native Student Education Support,Citywide (Northside Resource Center & Central Office),"Chicago Public Schools program ensuring American Indian and Alaskan Native students receive appropriate educational services. Provides family resource centers, cultural programming, youth ambassador opportunities, and support services. Operates the Citywide American Indian Education Council (CAIEC) and coordinates language/cultural programming partnerships.",t7kids.wordpress.com,,dmorales94@cps.edu,LIKELY_ACTIVE,2026-01-01,"Program was subject to a fraud investigation in Jan 2026 regarding funding, but historically maintains community presence.",Chicago_Indigenous_Solidarity_Volunteer_Orgs.xlsx
Chi-Nations Youth Council (CNYC),Youth Activism & Cultural Preservation,Albany Park / Citywide,"Founded 2012; diverse group of Native youth and adults with a mission to create a supportive, open environment for Native youth, raise awareness of cultural identity, and promote healthy lifestyles through arts, activism, and education. Led advocacy against race-based mascots, participated in Standing Rock movement, runs the First Nations Garden, and facilitates medicine walks and regalia-making.",chinations.org,,contact via chinations.org,VERIFIED,2025-01-01,Awarded the Indigenous Peoples' Social Justice Award in 2025.,Chicago_Indigenous_Solidarity_Volunteer_Orgs.xlsx
First Nations Garden,Land Stewardship & Environmental Justice,Albany Park,"Chicago's first Indigenous-led community garden, created in spring 2019 by Chi-Nations Youth Council on a 99-year urban land trust for the Native community. Located at the SE corner of Wilson Ave & N. Pulaski Rd in Albany Park. Provides a healing space for the intertribal Native community, promotes knowledge of Chicago's Indigenous landscape, native plants, and traditional ecological practices.",chicagotlan.org,,contact via chinations.org,VERIFIED,2026-04-01,Continued to receive municipal support and mutual aid grants as of April 2026.,Chicago_Indigenous_Solidarity_Volunteer_Orgs.xlsx
Gichigamiin Indigenous Nations Museum,Museum & Cultural Education,Evanston (Chicago Metro),"Formerly the Mitchell Museum of the American Indian (founded 1977); renamed Gichigamiin in 2024 as it became Native-led, shifting focus to Chicago's Native community and the tribal nations of the Great Lakes region. One of a handful of U.S. museums focusing exclusively on histories, cultures, and arts of Indigenous peoples. Actively recruits volunteer docents.",gichigamiin-museum.org,,Info@gichigamiin.org,VERIFIED,2026-06-01,Living Stories exhibition on display through June 2026.,Chicago_Indigenous_Solidarity_Volunteer_Orgs.xlsx
Indigenous Chicago,Public Education & Community Mapping,Near North Side (c/o Newberry Library),"Multifaceted collaboration between the Newberry Library, Chicago American Indian Community, and tribal nations with ancestral ties to Chicago. Produces interactive digital maps, temporary exhibitions, curriculum for high school social studies students, and public programming. Documents present and future Indigenous community presence across the city.",indigenous-chicago.org,,contact via indigenous-chicago.org,LIKELY_ACTIVE,2025-01-04,"Physical exhibition at Newberry ended Jan 2025, but digital resources and the project continue.",Chicago_Indigenous_Solidarity_Volunteer_Orgs.xlsx
Native American Chamber of Commerce of Illinois (NACC-IL),Economic Development & Business Support,Loop,"Provides business education, mentoring, and networking opportunities for Native American business owners and entrepreneurs throughout Illinois. Maintains a comprehensive directory of Illinois American Indian organizations. Supports American Indian-owned businesses with resources and tools to grow and succeed in the marketplace.",nacc-il.org,,info@nacc-il.org,VERIFIED,2025-01-01,Active in 2025-2026 providing business support and legislative advocacy.,Chicago_Indigenous_Solidarity_Volunteer_Orgs.xlsx
Newberry Library — D'Arcy McNickle Center,Research & Cultural Archives,Near North Side (Gold Coast),"The D'Arcy McNickle Center for American Indian and Indigenous Studies, founded 1972, is one of the most significant American Indian and Indigenous studies research centers in the country. Goals include improving scholarship on Indigenous peoples, educating teachers about Native cultures, assisting tribal historians, and providing a scholarly meeting ground. Home of the Indigenous Chicago project.",newberry.org/darcy-mcnickle-center,,contact via newberry.org,VERIFIED,2026-01-01,Hosting the 2026 NCAIS Graduate Student Conference and 2026 Summer Institute.,Chicago_Indigenous_Solidarity_Volunteer_Orgs.xlsx
Saint Kateri Center of Chicago,Spiritual Community & Cultural Preservation,Lakeview / North Center,"Ministry of the Archdiocese of Chicago dedicated to serving the American Indian Catholic community through faith formation, traditional prayers, and cultural programming. Hosts monthly Sunday Mass (1st & 3rd Sundays), an annual summer Pow Wow, language workshops (Cherokee, Lakota), and cultural events. Provides back-to-school supplies, youth conference participation, and guest speakers for the Native community.",stkatericenterchicago.org,,contact via stkatericenterchicago.org,LIKELY_ACTIVE,2025-01-01,"Specific 2025/2026 calendars not publicly detailed, but continues to serve the community with ongoing programs.",Chicago_Indigenous_Solidarity_Volunteer_Orgs.xlsx
Trickster Cultural Center,Cultural Arts Center,Schaumburg (Chicago Metro),"501(c)(3) Native American-led cultural arts center founded by Joseph Podlasek (LCO Ojibwe). A 10,000 sq ft facility dedicated to Native American culture, healing, and community in the Chicago area. Hosts art exhibitions, film screenings, cultural programming, and serves as a healing space for the intertribal urban Native community of greater Chicago.",tricksterculturalcenter.org,,contact via tricksterculturalcenter.org,VERIFIED,2026-05-01,Involved in a May 2026 feasibility study by the Village of Schaumburg; hosted 2026 Summer Youth Pow Wow.,Chicago_Indigenous_Solidarity_Volunteer_Orgs.xlsx
Big Brothers Big Sisters of Metropolitan Chicago,Youth Mentoring,Near West Side (citywide programs),"The Chicago affiliate of America's oldest and largest youth mentoring organization, providing one-to-one mentoring matches ('Bigs' and 'Littles') for almost 2,000 youth annually across Cook, DuPage, and Lake Counties. Bigs commit to meeting their Little at least twice per month for a minimum of one year. Programs include community-based mentoring, school-based mentoring (SBM), and workplace mentoring. Proven model: youth with Bigs are more likely to graduate high school and avoid risky behavior.",bbbschgo.org,,N/A (contact via bbbschgo.org/volunteer),VERIFIED,2026-04-24,Hosted Live Big 2026 in March and Big Bash in April 2026.,Chicago_Youth_Education_Volunteer_Orgs.xlsx
Chicago Arts Partnerships in Education (CAPE),Arts-Integrated Education,Bridgeport / Near South Side,"Nonprofit (est. 1992) that embeds professional teaching artists in Chicago Public School classrooms to co-teach with teachers, integrating the arts into core academics like math, science, and literacy. CAPE's model — arts as a teaching tool, not just enrichment — is backed by 30+ years of research showing improved academic outcomes, especially for students in under-resourced schools. Volunteers include professional artists, arts educators, and corporate skills volunteers supporting arts-integrated learning projects.",capechicago.org,,info@capechicago.org,VERIFIED,2026-01-01,Participated in the 2026 RE•VER•BER•ATE festival.,Chicago_Youth_Education_Volunteer_Orgs.xlsx
Chicago HOPES for Kids,Youth Education & Tutoring / Homeless Youth,Englewood / South Side,"Nonprofit providing free academic support, tutoring, enrichment, and trauma-informed care to school-age children experiencing homelessness in Chicago shelters and housing programs. Chicago HOPES for Kids sends trained volunteer tutors to shelters every Sunday, Tuesday, and Thursday to provide one-on-one academic support, homework help, and enrichment activities in a safe, nurturing environment. Serves one of Chicago's most vulnerable youth populations — children in emergency shelter.",chicagohopesforkids.org,,volunteer@chicagohopesforkids.org,VERIFIED,2026-01-01,Active AmeriCorps recruitment for 2026 terms and hosted 2026 Seeds of HOPE Casino Night.,Chicago_Youth_Education_Volunteer_Orgs.xlsx
Chicago Lights Tutoring,Youth Tutoring & Mentorship,Gold Coast / Near North Side,"A program of Fourth Presbyterian Church of Chicago providing free one-to-one tutoring and mentoring to youth in grades 3-12 from Chicago's most under-resourced neighborhoods. Chicago Lights pairs each student with a caring adult volunteer tutor who commits to a weekly session. In addition to academic support, the program weaves in mindfulness, career development, and enrichment resources. Volunteer tutors come from across Chicago and beyond — no teaching background required, just a commitment to show up.",chicagolights.org,,tutor@chicagolights.org,VERIFIED,2026-05-14,"2025–2026 school year program runs through May 14, 2026.",Chicago_Youth_Education_Volunteer_Orgs.xlsx
Chicago Scholars,College Access & First-Generation College Success,South Loop (serves citywide CPS),"Citywide nonprofit supporting first-generation, low-income Chicago Public School students through the complete college journey — from 10th grade through career launch. Chicago Scholars provides mentors, college advising, scholarships, internship connections, and alumni networks to ensure students not only access but graduate from college. Volunteers serve as mentors guiding scholars through college applications, financial aid, the first year on campus, and job searches. Impact: 95%+ college retention rate for Scholar participants.",chicagoscholars.org,,mentor@chicagoscholars.org,VERIFIED,2026-02-04,"Application deadline for the Class of 2031 was February 4, 2026.",Chicago_Youth_Education_Volunteer_Orgs.xlsx
Chicago Youth Centers (CYC),Youth Development & Out-of-School Time,Loop HQ (multiple neighborhoods),"Community-based youth development nonprofit (est. 1956) operating multiple centers across Chicago's most under-resourced neighborhoods — Englewood, Roseland, Lawndale, Humboldt Park, and others. CYC provides after-school programs, summer camps, sports leagues, mentoring, and college and career readiness for youth ages 6–18. Relies heavily on volunteers for center events, seasonal programming, tutoring, and operational support. Serves 8,000+ youth annually across Chicago's South and West Sides.",chicagoyouthcenters.org,,info@chicagoyouthcenters.org,VERIFIED,2026-02-27,"Hosted the annual Shake & Stir cocktail party on February 27, 2026.",Chicago_Youth_Education_Volunteer_Orgs.xlsx
Lumity,STEM Education & Career Pathways,South Loop,"Chicago nonprofit dedicated to shaping the future of STEM education and expanding career pathways for Chicagoland youth, particularly those from communities historically underrepresented in STEM. Lumity's signature program, STEMWorks, places Chicago Public School students in paid internships at STEM companies; STEMTalks brings STEM professionals directly into classrooms. Lumity also facilitates career site visits, professional mentoring, and resume workshops — all powered by volunteer professionals from the Chicago STEM community.",lumity.org,,qdellacella@lumity.org,VERIFIED,2026-05-20,Hosted 2026 Annual Benefit in March and Pours with Purpose in May 2026.,Chicago_Youth_Education_Volunteer_Orgs.xlsx
Mikva Challenge,Youth Civic Education & Leadership,Loop / South Loop,"National civic education nonprofit (est. 1997, HQ in Chicago) developing young people into empowered, informed, and active citizens. Mikva's Chicago programs include Project Soapbox (public speaking), Issues to Action (community organizing and advocacy curriculum), and Elections in Action (youth-led electoral engagement, including serving as student election judges). Partners with Chicago Public Schools to deliver curriculum and professional development. Over 14,000 youth engaged annually across Chicago.",mikvachallenge.org,,N/A (contact via mikvachallenge.org/contact),VERIFIED,2026-05-31,"Scheduled Soapbox Nation national event for May 31, 2026 in Chicago.",Chicago_Youth_Education_Volunteer_Orgs.xlsx
One Million Degrees (OMD),Community College Student Success Coaching,Loop (serves 10+ City Colleges campuses),"Chicago nonprofit that accelerates community college students' pathways to economic mobility by providing holistic supports — coaching, financial assistance, academic interventions, career development, and community — to hundreds of community college scholars across 10 Chicago-area colleges. Volunteer coaches serve as thought partners, cheerleaders, and accountability partners for OMD Scholars, meeting a few hours a month. Especially powerful for first-generation college students facing financial and life barriers.",onemilliondegrees.org,,info@onemilliondegrees.org,VERIFIED,2026-05-29,"2026 Degrees of Impact gala scheduled for May 29, 2026.",Chicago_Youth_Education_Volunteer_Orgs.xlsx
Project Exploration,STEM Science Education / Youth Development,Woodlawn / South Side,"Chicago-based nonprofit (est. 1999) addressing inequities in STEM access by providing high-quality, inspiring science education and youth development programs primarily for youth of color on Chicago's South Side. Programs include youth-led research, field science experiences, STEM internships, and summer science institutes. Volunteers and mentors who are passionate about science (professional scientists, science communicators, educators) serve as role models and hands-on program supporters for Chicago youth underrepresented in STEM.",projectexploration.org,,N/A (contact via projectexploration.org/volunteer),VERIFIED,2026-06-22,"Hosting full-day Summer 2026 STEM camps starting June 22, 2026.",Chicago_Youth_Education_Volunteer_Orgs.xlsx
Project: VISION,Youth Education & Leadership / API Community,Chinatown / Bridgeport,"Nonprofit (est. 2004) providing free after-school programs — tutoring, college and career readiness, service learning, and leadership development — to youth in grades 6–12 from Chicago's Chinatown and Bridgeport communities. Project: VISION has reached over 600 unique youth and emphasizes civic engagement, community identity, and personal development alongside academic support. One of very few Chicago youth nonprofits specifically centering Asian and Pacific Islander youth in under-resourced South Side communities.",projectvisionchicago.org,,N/A (contact via projectvisionchicago.org/contact-us),VERIFIED,2026-01-01,Actively executing its VISION 2027 strategic plan spanning 2025–2027.,Chicago_Youth_Education_Volunteer_Orgs.xlsx
Reading In Motion,Early Childhood Literacy,Loop (serves CPS schools),"Chicago nonprofit (est. 1983) with a mission to get every at-risk student reading at or above grade level in the early elementary grades through the power and discipline of the arts. Reading In Motion uses an arts-integration model — songs, movement, visual art, and drama — to make phonics and early reading engaging and effective for kindergarten through 3rd grade students in under-resourced Chicago schools. Volunteer literacy coaches work directly with classroom teachers and students in CPS schools.",readinginmotion.org,,engagementnv@readinginmotion.org,VERIFIED,2026-01-01,Confirmed active in 2026 operating in Chicago-area classrooms.,Chicago_Youth_Education_Volunteer_Orgs.xlsx
